title,author,goodreads_url,ol_title,ol_author,cover_url,openlibrary_url,description
James and the Giant Peach,Roald Dahl,https://www.goodreads.com/book/show/6689.James_and_the_Giant_Peach,James and the Giant Peach,Roald Dahl,https://covers.openlibrary.org/b/id/8252454-L.jpg,https://openlibrary.org/works/OL45809W,"***Roald Dahl's first and most widely celebrated book for young people continues to thrill readers around the world.***

**When James accidentally drops some magic crystals by the old peach tree, strange things start to happen.** The peach at the top of the tree begins to grow, and before long it's as big as a house. When James discovers a secret entrance-way into the fruit and crawls inside, he meets wonderful new friends--the Old-Green-Grasshopper, the dainty Ladybug, and the Centipede of the multiple boots. ***After years of feeling like an outsider in his aunts' house, James finally found a place where he belongs. With a snip of the stem, the peach household starts rolling away--and the adventure begins!***

""This is a stunning book to be cherished for its story, a superb fantasy.""***--Chicago Tribune***

""A beautifully written, fantastic book.""***--Christian Science Monitor***"
"A Wrinkle in Time (Time Quintet, #1)",Madeleine L'Engle,https://www.goodreads.com/book/show/33574273-a-wrinkle-in-time,,,,,
Don't Let the Pigeon Drive the Bus!,Mo Willems,https://www.goodreads.com/book/show/191113.Don_t_Let_the_Pigeon_Drive_the_Bus_,Don't Let the Pigeon Drive the Bus!,Mo Willems,https://covers.openlibrary.org/b/id/544664-L.jpg,https://openlibrary.org/works/OL5760013W,"No matter how hard he pleads and begs, the pigeon is not supposed to drive the bus while the driver is away, but pigeon tries every persuasive trick a young child knows to get you to say ""Yes."""
The Polar Express,Chris Van Allsburg,https://www.goodreads.com/book/show/420282.The_Polar_Express,The Polar Express Gift Set,Chris Van Allsburg,https://covers.openlibrary.org/b/id/394670-L.jpg,https://openlibrary.org/works/OL3743751W,A magical train ride on nochebuena (Christmas Eve) takes a boy to the North Pole to receive a special gift from San Nicolás.
The Phantom Tollbooth,Norton Juster,https://www.goodreads.com/book/show/378.The_Phantom_Tollbooth,The Phantom Tollbooth,Norton Juster,https://covers.openlibrary.org/b/id/8578174-L.jpg,https://openlibrary.org/works/OL1636262W,"The Phantom Tollbooth is a children's fantasy adventure novel written by Norton Juster with illustrations by Jules Feiffer. It was published in 1961 by Random House (USA). It tells the story of a bored young boy named Milo who unexpectedly receives a magic tollbooth one afternoon and, having nothing better to do, drives through it in his toy car, transporting him to the Kingdom of Wisdom, once prosperous but now troubled. There, he acquires two faithful companions, a dog named Tock and the Humbug, and goes on a quest to restore to the kingdom its exiled princesses—named Rhyme and Reason—from the Castle in the Air. In the process, he learns valuable lessons, finding a love of learning. The text is full of puns and wordplay, such as when Milo unintentionally jumps to Conclusions, an island in Wisdom, thus exploring the literal meanings of idioms."
"Little House in the Big Woods (Little House, #1)",Laura Ingalls Wilder,https://www.goodreads.com/book/show/8337.Little_House_in_the_Big_Woods,,,,,
"The Wonderful Wizard of Oz (Oz, #1)",L. Frank Baum,https://www.goodreads.com/book/show/236093.The_Wonderful_Wizard_of_Oz,,,,,
"Go, Dog. Go!",P.D. Eastman,https://www.goodreads.com/book/show/460548.Go_Dog_Go_,"Go, Dog. Go!",P. D. Eastman,https://covers.openlibrary.org/b/id/391827-L.jpg,https://openlibrary.org/works/OL517220W,"** WorldCat: Zany fun about all kinds of dogs and their doings, ending with a party at the top of a tree.
** Barnes and Noble: Reading goes to the dogs in this timeless Beginner Book edited by Dr. Seuss. From big dogs and little dogs to red, green, and blue dogs, dogs going up and dogs going fast . . . who knew dogs were so busy? And laughter will ensue at the repeated question “Do you like my hat?” Like P. D. Eastman’s classic Are You My Mother? Go, Dog. Go! has been a go-to favorite for over fifty years, leaving audiences of all breeds wagging their tails with delight.
** LibraryThing Reviewer: (Heather S. McCormick - Sep 18, 2019) I love this book, it's easy to read. has tons to look at in the books. I also like how throughout the book there is a reappearing girl who asks about her hat."
The Rainbow Fish,Marcus Pfister,https://www.goodreads.com/book/show/766020.The_Rainbow_Fish,The Rainbow Fish,Marcus Pfister,https://covers.openlibrary.org/b/id/9013570-L.jpg,https://openlibrary.org/works/OL507216W,The most beautiful fish in the entire ocean discovers the real value of personal beauty and friendship.
"The Giver (The Giver, #1)",Lois Lowry,https://www.goodreads.com/book/show/3636.The_Giver,,,,,
The Story of Ferdinand,Munro Leaf,https://www.goodreads.com/book/show/773951.The_Story_of_Ferdinand,The Story of Ferdinand,Munro Leaf,https://covers.openlibrary.org/b/id/6716679-L.jpg,https://openlibrary.org/works/OL4649312W,A gentle bull who likes to sit quietly and smell flowers is entered in a bullfight.
The Night Before Christmas,Clement Clarke Moore,https://www.goodreads.com/book/show/196970.The_Night_Before_Christmas,The Night Before Christmas,Clement Clarke Moore,https://covers.openlibrary.org/b/id/8236410-L.jpg,https://openlibrary.org/works/OL655908W,A well-known poem about an important Christmas Eve visitor.
Bridge to Terabithia,Katherine Paterson,https://www.goodreads.com/book/show/40940121-bridge-to-terabithia,Bridge to Terabithia,Katherine Paterson,https://covers.openlibrary.org/b/id/12627341-L.jpg,https://openlibrary.org/works/OL27079W,"The life of a ten-year-old boy in rural Virginia expands when he becomes friends with a newcomer who subsequently meets an untimely death trying to reach their hideaway, Terabithia, during a storm."
Blueberries for Sal,Robert McCloskey,https://www.goodreads.com/book/show/133526.Blueberries_for_Sal,Blueberries for Sal,Robert McCloskey,https://covers.openlibrary.org/b/id/11307420-L.jpg,https://openlibrary.org/works/OL4638387W,Recommended by Mental Floss: 50 Essential Children's Books
"Caps for Sale: A Tale of a Peddler, Some Monkeys and Their Monkey Business",Esphyr Slobodkina,https://www.goodreads.com/book/show/775597.Caps_for_Sale,"Caps for sale : a tale of a peddler, some monkeys, and their monkey business","Slobodkina, Esphyr",,https://openlibrary.org/works/OL4295900W,
Clifford the Big Red Dog,Norman Bridwell,https://www.goodreads.com/book/show/858719.Clifford_the_Big_Red_Dog,Clifford the Big Red Dog,Norman Bridwell,https://covers.openlibrary.org/b/id/383686-L.jpg,https://openlibrary.org/works/OL73128W,Emily Elizabeth describes the activities she enjoys with her very big red dog and how they take care of each other.
The Witches,Roald Dahl,https://www.goodreads.com/book/show/6327.The_Witches,The Witches,Roald Dahl,https://covers.openlibrary.org/b/id/12374442-L.jpg,https://openlibrary.org/works/OL45886W,
Fox in Socks,Dr. Seuss,https://www.goodreads.com/book/show/105551.Fox_in_Socks,Fox in Socks,Dr. Seuss,https://covers.openlibrary.org/b/id/8832133-L.jpg,https://openlibrary.org/works/OL261159W,"The book begins by introducing Fox and Knox (sometimes called ""Mr. Fox"" and ""Mr. Knox"") along with some props (a box and a pair of socks). After taking those four rhyming items through several permutations, more items are added (chicks, bricks, blocks, clocks), and so on. As the book progresses the Fox describes each situation with rhymes that progress in complexity, with Knox periodically complaining of the difficulty of the tongue-twisters. Finally, after the Fox gives an extended dissertation on Tweetle Beetles who fight (battle) with paddles while standing in a puddle inside a bottle (a Tweetle Beetle Bottle Puddle Paddle Battle Muddle), Knox acts on his frustration by stuffing Fox into the bottle, reciting a tongue-twister of his own: When a fox is in the bottle where the tweetle beetles battle with their paddles in a puddle on a noodle-eating poodle, THIS is what they call... a tweetle beetle noodle poodle bottled paddled muddled duddled fuddled wuddled fox in socks, sir! Knox then declares that the game is finished, thanking the Fox for the fun, and walks away while the beetles, a poodle, and the stunned Fox watch. - Wikipedia."
"The Lion, the Witch and the Wardrobe (Chronicles of Narnia, #1)",C.S. Lewis,https://www.goodreads.com/book/show/100915.The_Lion_the_Witch_and_the_Wardrobe,,,,,
"Little Bear (Little Bear, #1)",Else Holmelund Minarik,https://www.goodreads.com/book/show/201146.Little_Bear,,,,,
"The Snowy Day (Peter, #1)",Ezra Jack Keats,https://www.goodreads.com/book/show/310258.The_Snowy_Day,,,,,
The Paper Bag Princess,Robert Munsch,https://www.goodreads.com/book/show/240130.The_Paper_Bag_Princess,The Paper Bag Princess (Classic Munsch),Robert N Munsch,https://covers.openlibrary.org/b/id/707991-L.jpg,https://openlibrary.org/works/OL88684W,"Story about not accepting failure or giving up on what you want.  It's not about looks or power but tenacity and quick thinking. Hurray for you Princess of the Paper Bag.  Very short, easy reading.  I wanted to hear more about her."
Tikki Tikki Tembo,Arlene Mosel,https://www.goodreads.com/book/show/551876.Tikki_Tikki_Tembo,Tikki Tikki Tembo,Arlene Mosel,https://covers.openlibrary.org/b/id/579117-L.jpg,https://openlibrary.org/works/OL4510657W,The book tells the story of a Chinese boy with a long name who fell into a well. It is a sort of origin myth about why Chinese names are so short today (wikipedia)
A Bad Case of Stripes (Scholastic Bookshelf),David Shannon,https://www.goodreads.com/book/show/474858.A_Bad_Case_of_Stripes,,,,,
"Winnie-the-Pooh (Winnie-the-Pooh, #1)",A.A. Milne,https://www.goodreads.com/book/show/99107.Winnie_the_Pooh,"When We Were Very Young - Winnie-The-Pooh Series, Book #1 - Unabridged",A. A. Milne,,https://openlibrary.org/works/OL34301881W,
Chrysanthemum,Kevin Henkes,https://www.goodreads.com/book/show/858513.Chrysanthemum,Chrysanthemum,Kevin Henkes,https://covers.openlibrary.org/b/id/6712201-L.jpg,https://openlibrary.org/works/OL469283W,"Chrysanthemum loves her name, until she starts going to school and the other children make fun of it."
"Miss Nelson Is Missing! (Miss Nelson, #1)",Harry Allard,https://www.goodreads.com/book/show/147732.Miss_Nelson_Is_Missing_,,,,,
"Click, Clack, Moo: Cows That Type",Doreen Cronin,https://www.goodreads.com/book/show/766955.Click_Clack_Moo,"Click, Clack, Moo Cows That Type",Doreen Cronin,https://covers.openlibrary.org/b/id/5725264-L.jpg,https://openlibrary.org/works/OL5703631W,"When Farmer Brown's cows find a typewriter in the barn they start making demands, and go on strike when the farmer refuses to give them what they want."
Falling Up,Shel Silverstein,https://www.goodreads.com/book/show/30120.Falling_Up,Falling Up,Shel Silverstein,https://covers.openlibrary.org/b/id/26482-L.jpg,https://openlibrary.org/works/OL3368286W,A collection of humorous poems and drawings.
From the Mixed-Up Files of Mrs. Basil E. Frankweiler,E.L. Konigsburg,https://www.goodreads.com/book/show/3980.From_the_Mixed_Up_Files_of_Mrs_Basil_E_Frankweiler,From the Mixed-Up Files of Mrs. Basil E. Frankweiler,E. L. Konigsburg,https://covers.openlibrary.org/b/id/541206-L.jpg,https://openlibrary.org/works/OL2987238W,"Having run away with her younger brother to live in the Metropolitan Museum of Art, twelve-year-old Claudia strives to keep things in order in their new home and to become a changed person and a heroine to herself."
The Tale of Despereaux,Kate DiCamillo,https://www.goodreads.com/book/show/37190.The_Tale_of_Despereaux,"The Mouse and the Princess
            
                Tale of Despereaux",Kate DiCamillo,https://covers.openlibrary.org/b/id/7827814-L.jpg,https://openlibrary.org/works/OL17563120W,
The Sneetches and Other Stories,Dr. Seuss,https://www.goodreads.com/book/show/105549.The_Sneetches_and_Other_Stories,The Sneetches and other stories,Dr. Seuss,https://covers.openlibrary.org/b/id/11354-L.jpg,https://openlibrary.org/works/OL1898283W,"A book of humorous stories in rhyme. 

The stories are The Sneetches, The Zax, Too Many Daves, and What Was I Scared Of?"
"The Story of Babar (Babar, #1)",Jean de Brunhoff,https://www.goodreads.com/book/show/356321.The_Story_of_Babar,,,,,
"The Indian in the Cupboard (The Indian in the Cupboard, #1)",Lynne Reid Banks,https://www.goodreads.com/book/show/125404.The_Indian_in_the_Cupboard,,,,,
The Adventures of Tom Sawyer,Mark Twain,https://www.goodreads.com/book/show/24583.The_Adventures_of_Tom_Sawyer,The Adventures of Tom Sawyer,Mark Twain,https://covers.openlibrary.org/b/id/12043351-L.jpg,https://openlibrary.org/works/OL53919W,"Mark Twain created the memorable characters Tom Sawyer and Huckleberry Finn drawing from the experiences of boys he grew up with in Missouri. Set by the Mississippi River in the 1840's, it follows these boys as they get into predicament after predicament. Tom's classic whitewashing of the fence has become part of American legend, and the book paints a nostalgic picture of life in the middle of the nineteenth century. Tom runs away from home to an island in the river, chases Injun Joe and his treasure, and even gets trapped in a cave for days with Becky Thatcher. The book is one of Twain's most beloved stories."
"Olivia (Olivia, #1)",Ian Falconer,https://www.goodreads.com/book/show/770051.Olivia,,,,,
"The Mouse and the Motorcycle (Ralph S. Mouse, #1)",Beverly Cleary,https://www.goodreads.com/book/show/232109.The_Mouse_and_the_Motorcycle,,,,,
"The Little House Collection (Little House, #1-9)",Laura Ingalls Wilder,https://www.goodreads.com/book/show/114345.The_Little_House_Collection,,,,,
"Sideways Stories from Wayside School (Wayside School, #1)",Louis Sachar,https://www.goodreads.com/book/show/15779.Sideways_Stories_from_Wayside_School,,,,,
"Ramona the Pest (Ramona, #2)",Beverly Cleary,https://www.goodreads.com/book/show/78039.Ramona_the_Pest,,,,,
The Neverending Story,Michael Ende,https://www.goodreads.com/book/show/27712.The_Neverending_Story,The Neverending Story,Michael Ende,https://covers.openlibrary.org/b/id/13200934-L.jpg,https://openlibrary.org/works/OL31587398W,
The Little House,Virginia Lee Burton,https://www.goodreads.com/book/show/153540.The_Little_House,The Little House,Virginia Lee Burton,https://covers.openlibrary.org/b/id/8772064-L.jpg,https://openlibrary.org/works/OL3253362W,"A country house is unhappy when the city, with all its buildings and traffic, grows up around her."
Hop On Pop,Dr. Seuss,https://www.goodreads.com/book/show/206962.Hop_On_Pop,Hop on Pop,Dr. Seuss,https://covers.openlibrary.org/b/id/254551-L.jpg,https://openlibrary.org/works/OL261164W,"**LibraryThing: Pairs of rhyming words are introduced and used in simple sentences, such as ""Day. Play. We play all day. Night. Fight. We fight all night."""
Harry the Dirty Dog,Gene Zion,https://www.goodreads.com/book/show/857448.Harry_the_Dirty_Dog,Harry the Dirty Dog,Gene Zion,https://covers.openlibrary.org/b/id/24282-L.jpg,https://openlibrary.org/works/OL1973379W,"When a white dog with black spots runs away from home, he gets so dirty his family doesn't recognize him as a black dog with white spots."
"Bunnicula: A Rabbit-Tale of Mystery (Bunnicula, #1)",Deborah Howe,https://www.goodreads.com/book/show/281235.Bunnicula,,,,,
Horton Hatches the Egg,Dr. Seuss,https://www.goodreads.com/book/show/11301.Horton_Hatches_the_Egg,Horton Hatches the Egg,Dr. Seuss,https://covers.openlibrary.org/b/id/254565-L.jpg,https://openlibrary.org/works/OL261166W,"When a lazy bird hatching an egg wants a vacation, she asks Horton, the elephant, to sit on her egg--which he does through all sorts of hazards until he is rewarded for doing what he said he would."
The Runaway Bunny,Margaret Wise Brown,https://www.goodreads.com/book/show/58922.The_Runaway_Bunny,The Runaway Bunny,Margaret Wise Brown,https://covers.openlibrary.org/b/id/8743590-L.jpg,https://openlibrary.org/works/OL151861W,"A little rabbit who wants to run away tells his mother how he will escape, but she is always right behind him."
"Harry Potter and the Prisoner of Azkaban (Harry Potter, #3)",J.K. Rowling,https://www.goodreads.com/book/show/5.Harry_Potter_and_the_Prisoner_of_Azkaban,,,,,
Stone Soup,Jon J. Muth,https://www.goodreads.com/book/show/331701.Stone_Soup,Stone soup,Jon J. Muth,https://covers.openlibrary.org/b/id/277258-L.jpg,https://openlibrary.org/works/OL2222906W,"Three strangers, hungry and tired, pass through a war-torn village. Embittered and suspicious from the war, the people hide their food and close their windows tight. That is, until the clever strangers suggest making a soup from stones. Intrigued by the idea, everyone brings what they have until-- together, they have made a feast fit for a king! (amazon).

The story tell us that giving is happiness and sharing makes us all richer.."
A Light in the Attic,Shel Silverstein,https://www.goodreads.com/book/show/30118.A_Light_in_the_Attic,A light in the attic,Shel Silverstein,https://covers.openlibrary.org/b/id/6806998-L.jpg,https://openlibrary.org/works/OL15843795W,A collection of humorous poems and drawings.
"Harry Potter and the Chamber of Secrets (Harry Potter, #2)",J.K. Rowling,https://www.goodreads.com/book/show/15881.Harry_Potter_and_the_Chamber_of_Secrets,,,,,
The Three Billy Goats Gruff,Paul Galdone,https://www.goodreads.com/book/show/789559.The_Three_Billy_Goats_Gruff,The Three Billy Goats Gruff,Paul Galdone,https://covers.openlibrary.org/b/id/5089863-L.jpg,https://openlibrary.org/works/OL5098900W,
Peter Pan,J.M. Barrie,https://www.goodreads.com/book/show/34268.Peter_Pan,Peter Pan,J. M. Barrie,https://covers.openlibrary.org/b/id/8237052-L.jpg,https://openlibrary.org/works/OL462007W,"The adventures of the three Darling children in Never-Never Land with Peter Pan, the boy who would not grow up."
"The Boxcar Children (The Boxcar Children, #1)",Gertrude Chandler Warner,https://www.goodreads.com/book/show/297249.The_Boxcar_Children,"Boxcar Children Early Reader Set #1 (the Boxcar Children: Time to Read, Level 2)",Gertrude Chandler Warner,,https://openlibrary.org/works/OL25224130W,
Yertle the Turtle and Other Stories,Dr. Seuss,https://www.goodreads.com/book/show/420404.Yertle_the_Turtle_and_Other_Stories,Yertle the Turtle and Other Stories (Dr Seuss Yellow Back Book),Dr. Seuss,https://covers.openlibrary.org/b/id/12065-L.jpg,https://openlibrary.org/works/OL261218W,
"Frog and Toad Together (Frog and Toad, #2)",Arnold Lobel,https://www.goodreads.com/book/show/94803.Frog_and_Toad_Together,,,,,
"Harry Potter and the Deathly Hallows (Harry Potter, #7)",J.K. Rowling,https://www.goodreads.com/book/show/136251.Harry_Potter_and_the_Deathly_Hallows,,,,,
"You Are Special (Wemmicksville, #1)",Max Lucado,https://www.goodreads.com/book/show/56728.You_Are_Special,,,,,
"Harry Potter and the Goblet of Fire (Harry Potter, #4)",J.K. Rowling,https://www.goodreads.com/book/show/6.Harry_Potter_and_the_Goblet_of_Fire,,,,,
A Little Princess,Frances Hodgson Burnett,https://www.goodreads.com/book/show/3008.A_Little_Princess,A Little Princess,Frances Hodgson Burnett,https://covers.openlibrary.org/b/id/2328315-L.jpg,https://openlibrary.org/works/OL69630W,"This is a story about a different kind of princess than one might imagine; a princess that is an orphan - lonely, cold, hungry and abused. Sara Crewe begins life as the beloved, pampered daughter of a rich man. When he dies a pauper, she is thrown on the non-existent mercy of her small-minded, mercenary boarding school mistress. Stripped of all her belongings but for one set of clothes and a doll, Sara becomes a servant of the household. Hated by the schoolmistress for her independent spirit, Sara becomes a pariah in the household, with only a few secretly loyal friends. But through her inner integrity and strength of will, Sara Crewe maintains the deportment, inner nobility and generous spirit of a ""real"" princess."
"Mrs. Piggle-Wiggle (Mrs. Piggle Wiggle, #1)",Betty MacDonald,https://www.goodreads.com/book/show/25051.Mrs_Piggle_Wiggle,,,,,
Lilly's Purple Plastic Purse,Kevin Henkes,https://www.goodreads.com/book/show/825081.Lilly_s_Purple_Plastic_Purse,Lilly's Purple Plastic Purse,Kevin Henkes,https://covers.openlibrary.org/b/id/432406-L.jpg,https://openlibrary.org/works/OL469206W,"Lilly loves everything about school, especially her teacher, but when he asks her to wait a while before showing her new purse, she does something for which she is very sorry later."
"Holes (Holes, #1)",Louis Sachar,https://www.goodreads.com/book/show/38709.Holes,,,,,
And to Think That I Saw It on Mulberry Street,Dr. Seuss,https://www.goodreads.com/book/show/28351.And_to_Think_That_I_Saw_It_on_Mulberry_Street,And to think that I saw it on Mulberry Street,Dr. Seuss,https://covers.openlibrary.org/b/id/5391016-L.jpg,https://openlibrary.org/works/OL1898303W,"""Dr. Seuss’s very first book for children! From a mere horse and wagon, young Marco concocts a colorful cast of characters, making Mulberry Street the most interesting location in town. Dr. Seuss’s signature rhythmic text, combined with his unmistakable illustrations, will appeal to fans of all ages, who will cheer when our hero proves that a little imagination can go a very long way. (Who wouldn’t cheer when an elephant-pulled sleigh raced by?) Now over seventy-five years old, this story is as timeless as ever. And Marco’s singular kind of optimism is also evident in McElligot’s Pool"" - Google Books"
The Mitten,Jan Brett,https://www.goodreads.com/book/show/967494.The_Mitten,The mitten,Jan Brett,https://covers.openlibrary.org/b/id/259482-L.jpg,https://openlibrary.org/works/OL13933W,Several animals sleep snugly in Nicki's lost mitten until the bear sneezes.
"Harry Potter and the Half-Blood Prince (Harry Potter, #6)",J.K. Rowling,https://www.goodreads.com/book/show/1.Harry_Potter_and_the_Half_Blood_Prince,,,,,
The Kissing Hand,Audrey Penn,https://www.goodreads.com/book/show/18419.The_Kissing_Hand,The Kissing Hand,Audrey Penn,https://covers.openlibrary.org/b/id/673400-L.jpg,https://openlibrary.org/works/OL1899645W,"When Chester the raccoon is reluctant to go to kindergarten for the first time, his mother teaches him a secret way to carry her love with him."
"Harry Potter and the Order of the Phoenix (Harry Potter, #5)",J.K. Rowling,https://www.goodreads.com/book/show/2.Harry_Potter_and_the_Order_of_the_Phoenix,,,,,
Sylvester and the Magic Pebble,William Steig,https://www.goodreads.com/book/show/457762.Sylvester_and_the_Magic_Pebble,Sylvester and the magic pebble,William Steig,https://covers.openlibrary.org/b/id/12727145-L.jpg,https://openlibrary.org/works/OL22328W,"In a moment of fright, Sylvester the donkey asks his magic pebble to turn him into a rock but then can not hold the pebble to wish himself back to normal again."
"Knuffle Bunny: A Cautionary Tale (Knuffle Bunny, #1)",Mo Willems,https://www.goodreads.com/book/show/490867.Knuffle_Bunny,,,,,
Strega Nona,Tomie dePaola,https://www.goodreads.com/book/show/581409.Strega_Nona,Strega Nona,Tomie dePaola,https://covers.openlibrary.org/b/id/4482016-L.jpg,https://openlibrary.org/works/OL61090W,"Strega Nona is a lovable grandmotherly witch who helps all the townspeople with their problems.She hires Big Anthony to help her with chores. One day he hears her singing to the pasta pot. He however, does not see her blowing three kisses to make it stop. Her one rule is never to touch the pasta pot, but when she is away Big Anthony takes it out and sing the song to it, then invites all the townspeople to come and get pasta. The problem comes when he c\n't stop the pot. In the end, his punishment fits the crime."
The Dot,Peter H. Reynolds,https://www.goodreads.com/book/show/825377.The_Dot,The dot,Peter H. Reynolds,https://covers.openlibrary.org/b/id/516041-L.jpg,https://openlibrary.org/works/OL2435178W,"Vashti believes that she cannot draw, but her art teacher's encouragement leads her to change her mind."
Dogs vs Bears,Austin    Davis,https://www.goodreads.com/book/show/197525278-dogs-vs-bears,Dogs vs Bears,Austin Davis,,https://openlibrary.org/works/OL37572717W,
There Was an Old Lady Who Swallowed a Fly,Pam Adams,https://www.goodreads.com/book/show/949709.There_Was_an_Old_Lady_Who_Swallowed_a_Fly,There was an old lady who swallowed a fly,Pam Adams,https://covers.openlibrary.org/b/id/651393-L.jpg,https://openlibrary.org/works/OL18299726W,"An illustrated version of the cumulative folk song in which the solution proves worse than the predicament when an old lady swallows a fly. Some pages are die-cut, permitting a portion of the next illustration to be seen."
Coraline,Neil Gaiman,https://www.goodreads.com/book/show/17061.Coraline,Coraline,Neil Gaiman,https://covers.openlibrary.org/b/id/14171421-L.jpg,https://openlibrary.org/works/OL679358W,"When Coraline steps through a door to find another house strangely similar to her own (only better), things seem marvelous.

But there's another mother there, and another father, and they want her to stay and be their little girl. They want to change her and never let her go.

Coraline will have to fight with all her wit and courage if she is to save herself and return to her ordinary life."
"Little Women (Little Women, #1)",Louisa May Alcott,https://www.goodreads.com/book/show/1934.Little_Women,,,,,
