title,author,goodreads_url,ol_title,ol_author,cover_url,openlibrary_url,description
Number the Stars,Lois Lowry,https://www.goodreads.com/book/show/47281.Number_the_Stars,Number the Stars,Lois Lowry,https://covers.openlibrary.org/b/id/13249599-L.jpg,https://openlibrary.org/works/OL1846074W,"Ten-year-old Annemarie Johansen and her best friend, Ellen Rosen, often think about life before the war. But it's now 1943, and their life in Copenhagen is filled with school, food shortages, and the Nazi soldiers marching in their town.
The Nazis won't stop. The Jews of Denmark are being ""relocated,"" so Ellen moves in with the Johansens and pretends to be part of the family. Then Annemarie is asked to go on a dangerous mission. Somehow she must find the strength and courage to save her best friend's life. There's no turning back now."
"Little House on the Prairie (Little House, #3)",Laura Ingalls Wilder,https://www.goodreads.com/book/show/77767.Little_House_on_the_Prairie,,,,,
"Ella Enchanted (Ella Enchanted, #1)",Gail Carson Levine,https://www.goodreads.com/book/show/24337.Ella_Enchanted,,,,,
"The Borrowers (The Borrowers, #1)",Mary Norton,https://www.goodreads.com/book/show/348573.The_Borrowers,,,,,
The Going To Bed Book,Sandra Boynton,https://www.goodreads.com/book/show/53580.The_Going_To_Bed_Book,The Going to Bed Book,Sandra Boynton,https://covers.openlibrary.org/b/id/438326-L.jpg,https://openlibrary.org/works/OL1738446W,"An assortment of animals on a boat take a bath, put on their pajamas, brush their teeth, and exercise before going to bed."
"Tales of a Fourth Grade Nothing (Fudge, #1)",Judy Blume,https://www.goodreads.com/book/show/37741.Tales_of_a_Fourth_Grade_Nothing,,,,,
A Day in the Life of Cowboy Mike and Winston,Michael Eastwood,https://www.goodreads.com/book/show/72403204-a-day-in-the-life-of-cowboy-mike-and-winston,,,,,
Dr. Seuss's ABC: An Amazing Alphabet Book!,Dr. Seuss,https://www.goodreads.com/book/show/17797344-dr-seuss-s-abc,Dr. Seuss's ABC An Amazing Alphabet Book!,Dr. Seuss,https://covers.openlibrary.org/b/id/6668460-L.jpg,https://openlibrary.org/works/OL14949037W,
The Wind in the Willows,Kenneth Grahame,https://www.goodreads.com/book/show/5659.The_Wind_in_the_Willows,Wind in the Willows,Kenneth Grahame,https://covers.openlibrary.org/b/id/13335427-L.jpg,https://openlibrary.org/works/OL28570037W,"The adventures of four amiable animals, Rat, Toad, Mole and Badger, along a river in the English countryside."
The Day the Crayons Quit,Drew Daywalt,https://www.goodreads.com/book/show/16101018-the-day-the-crayons-quit,The Day the Crayons Quit,Drew Daywalt,https://covers.openlibrary.org/b/id/8314152-L.jpg,https://openlibrary.org/works/OL17104369W,"When Duncan arrives at school one morning, he finds a stack of letters, one from each of his crayons, complaining about how he uses them."
How to Eat Fried Worms,Thomas Rockwell,https://www.goodreads.com/book/show/322351.How_to_Eat_Fried_Worms,How To Eat Fried Worms,Thomas Rockwell,https://covers.openlibrary.org/b/id/14228597-L.jpg,https://openlibrary.org/works/OL4449820W,See https://openlibrary.org/works/OL4449847W/How_to_Eat_Fried_Worms
The Complete Fairy Tales,Hans Christian Andersen,https://www.goodreads.com/book/show/46306.The_Complete_Fairy_Tales,The Complete Fairy Tales,Hans Christian Andersen,https://covers.openlibrary.org/b/id/10315541-L.jpg,https://openlibrary.org/works/OL20978130W,
Mike Mulligan and His Steam Shovel,Virginia Lee Burton,https://www.goodreads.com/book/show/153542.Mike_Mulligan_and_His_Steam_Shovel,Mike Mulligan and His Steam Shovel,Virginia Lee Burton,https://covers.openlibrary.org/b/id/1196476-L.jpg,https://openlibrary.org/works/OL3253363W,"When Mike Mulligan and his steam shovel, Mary Ann, lose their jobs to the gasoline, electric, and diesel motor shovels, they go to a little country town where they find that one new job leads to another."
The Napping House,Audrey Wood,https://www.goodreads.com/book/show/815234.The_Napping_House,The Napping House (La Casa Adormecida),Audrey Wood,https://covers.openlibrary.org/b/id/114437-L.jpg,https://openlibrary.org/works/OL547418W,"In this cumulative tale, a wakeful flea atop a number of sleeping creatures causes a commotion, with just one bite."
"Watership Down (Watership Down, #1)",Richard  Adams,https://www.goodreads.com/book/show/76620.Watership_Down,,,,,
The Mystic Princesses and the Whirlpool,P.J. LaRue,https://www.goodreads.com/book/show/17235412-the-mystic-princesses-and-the-whirlpool,,,,,
"Mary Poppins (Mary Poppins, #1)",P.L. Travers,https://www.goodreads.com/book/show/152380.Mary_Poppins,,,,,
Where the Red Fern Grows,Wilson Rawls,https://www.goodreads.com/book/show/10365.Where_the_Red_Fern_Grows,Where the Red Fern Grows,Wilson Rawls,https://covers.openlibrary.org/b/id/7996608-L.jpg,https://openlibrary.org/works/OL465360W,"Where the Red Fern Grows is a 1961 children's novel by Wilson Rawls about a boy who buys two hunting dogs.

----------
Also contained in:
[Prentice Hall Literature: Bronze](https://openlibrary.org/works/OL24558491W)"
"The Bad Beginning (A Series of Unfortunate Events, #1)",Lemony Snicket,https://www.goodreads.com/book/show/78411.The_Bad_Beginning,,,,,
"World Cruise by Whale: Mike and Alex, Parts 3 and 4",Peter Van Wermeskerken,https://www.goodreads.com/book/show/216716338-world-cruise-by-whale,,,,,
"The Little Mouse, the Red Ripe Strawberry, and the Big Hungry Bear",Don Wood,https://www.goodreads.com/book/show/682920.The_Little_Mouse_the_Red_Ripe_Strawberry_and_the_Big_Hungry_Bear,"The Little Mouse, the Ripe Red Strawberry, and the Big Hungry Bear",Audrey Wood,https://covers.openlibrary.org/b/id/651372-L.jpg,https://openlibrary.org/works/OL547420W,"Little Mouse worries that the big, hungry bear will take his freshly picked, ripe, red strawberry for himself."
"Heidi (Heidi, #1-2)",Johanna Spyri,https://www.goodreads.com/book/show/93.Heidi,,,,,
The Invisible Boy,Trudy Ludwig,https://www.goodreads.com/book/show/17140549-the-invisible-boy,The Invisible Boy,Trudy Ludwig,https://covers.openlibrary.org/b/id/10566292-L.jpg,https://openlibrary.org/works/OL19969916W,"Meet Brian, the invisible boy. Nobody ever seems to notice him or think to include him in their group, game, or birthday party... until, that is, a new kid comes to class.

When Justin, the new boy, arrives, Brian is the first to make him feel welcome. And when Brian and Justin team up to work on a class project together, Brian finds a way to shine.

From esteemed author and speaker Trudy Ludwig and acclaimed illustrator Patrice Barton, this gentle story shows how small acts of kindness can help children feel included and allow them to flourish. Any parent, teacher, or counselor looking for material that sensitively addresses the needs of quieter children will find The Invisible Boy a valuable and important resource.

Includes backmatter with discussion questions and resources for further reading."
Bread and Jam for Frances (I Can Read Level 2),Russell Hoban,https://www.goodreads.com/book/show/911579.Bread_and_Jam_for_Frances,,,,,
"Are You There God? It’s Me, Margaret",Judy Blume,https://www.goodreads.com/book/show/37732.Are_You_There_God_It_s_Me_Margaret,"Are You There God? It's Me, Margaret.",Judy Blume,https://covers.openlibrary.org/b/id/12388102-L.jpg,https://openlibrary.org/works/OL268217W,"Are You There God? It's Me, Margaret. is a 1970 novel by Judy Blume, typically categorized as a young adult book. It follows a sixth-grade girl who has grown up without a religious affiliation, due to her parents' interfaith marriage. The novel explores her quest for a single religion, while confronting typical issues faced by early adolescent girls going through puberty, such as buying her first bra, having her first period, and feeling attracted to certain boys. The novel has been frequently challenged since the 1980s for its frank discussions of sexual and religious topics.

In 2010, the book was placed on Time's list of the top 100 fiction books written in English since 1923."
The Bad Seed (The Food Group #1),Jory John,https://www.goodreads.com/book/show/39991777-the-bad-seed,,,,,
