title,author,goodreads_url,ol_title,ol_author,cover_url,openlibrary_url,description
Where the Wild Things Are,Maurice Sendak,https://www.goodreads.com/book/show/19543.Where_the_Wild_Things_Are,Where the Wild Things Are,Maurice Sendak,https://covers.openlibrary.org/b/id/50842-L.jpg,https://openlibrary.org/works/OL2568879W,"This is an inspired children's book about a boy's passage through tempestuous aspects of life.

Max, a naughty little boy, sent to bed without his supper, sails to the land of the wild things, where he becomes their king."
The Very Hungry Caterpillar,Eric Carle,https://www.goodreads.com/book/show/4948.The_Very_Hungry_Caterpillar,The Very Hungry Caterpillar,Eric Carle,https://covers.openlibrary.org/b/id/7835968-L.jpg,https://openlibrary.org/works/OL52987W,"One sunny day, a caterpillar pops out of an egg. He is very hungry and begins searching for food.  He eats his way through ten very sweet pages and gets a tummy ache before finally finding a good, healthy leaf, which makes him sleepy. Then something really amazing happens. But you will have to read it your self to find out what!"
The Giving Tree,Shel Silverstein,https://www.goodreads.com/book/show/370493.The_Giving_Tree,The Giving Tree,Shel Silverstein,https://covers.openlibrary.org/b/id/8981758-L.jpg,https://openlibrary.org/works/OL3368288W,"From Shel Silverstein, New York Times bestselling author of Where the Sidewalk Ends and A Light in the Attic, comes a poignant picture book about love and acceptance, cherished for over fifty years. This classic is perfect for both young readers and lifelong fans.

""Once there was a tree...and she loved a little boy.""

So begins a story of unforgettable perception, beautifully written and illustrated by the gifted and versatile Shel Silverstein. This moving parable for all ages offers a touching interpretation of the gift of giving and a serene acceptance of another's capacity to love in return.

Every day the boy would come to the tree to eat her apples, swing from her branches, or slide down her trunk...and the tree was happy. But as the boy grew older he began to want more from the tree, and the tree gave and gave and gave. This is a tender story, touched with sadness, aglow with consolation.

The Giving Tree is a meaningful gift for milestone events such as graduations, birthdays, and baby showers.

Shel Silverstein's incomparable career as a bestselling children's book author and illustrator began with Lafcadio, the Lion Who Shot Back. He is also the creator of picture books including A Giraffe and a Half, Who Wants a Cheap Rhinoceros?, The Missing Piece, The Missing Piece Meets the Big O, and the perennial favorite The Giving Tree, and of classic poetry collections such as Where the Sidewalk Ends, A Light in the Attic, Falling Up, Every Thing On It, Don't Bump the Glump!, and Runny Babbit plus Runny Babbit Returns."
Green Eggs and Ham,Dr. Seuss,https://www.goodreads.com/book/show/23772.Green_Eggs_and_Ham,Green Eggs and Ham,Dr. Seuss,https://covers.openlibrary.org/b/id/231746-L.jpg,https://openlibrary.org/works/OL1898308W,"Sam-I-am tries to persuade the character in the top hat to try green eggs and ham.
 “Do you like green eggs and ham?” asks Sam-I-am in this Beginner Book by Dr. Seuss. In a house or with a mouse? In a boat or with a goat? On a train or in a tree? Sam keeps asking persistently. With unmistakable characters and signature rhymes, Dr. Seuss’s beloved favorite has cemented its place as a children’s classic. In this most famous of cumulative tales, the list of places to enjoy green eggs and ham, and friends to enjoy them with, gets longer and longer. Follow Sam-I-am as he insists that this unusual treat is indeed a delectable snack to be savored everywhere and in every way."
Goodnight Moon,Margaret Wise Brown,https://www.goodreads.com/book/show/32929.Goodnight_Moon,Goodnight Moon,Margaret Wise Brown,https://covers.openlibrary.org/b/id/35556-L.jpg,https://openlibrary.org/works/OL151798W,"Goodnight to each of the objects in the great green room: the chairs, a comb, and the air."
Charlotte’s Web,E.B. White,https://www.goodreads.com/book/show/24178.Charlotte_s_Web,Charlotte's Web,E. B. White,https://covers.openlibrary.org/b/id/8461797-L.jpg,https://openlibrary.org/works/OL483391W,"Charlotte's Web is a book of children's literature by American author E. B. White and illustrated by Garth Williams; it was published on October 15, 1952, by Harper & Brothers. The novel tells the story of a livestock pig named Wilbur and his friendship with a barn spider named Charlotte. When Wilbur is in danger of being slaughtered by the farmer, Charlotte writes messages praising Wilbur (such as ""Some Pig"") in her web in order to persuade the farmer to let him live.


----------
Also contained in:
[Novels](https://openlibrary.org/works/OL483326W)"
"The Cat in the Hat (Cat in the Hat, #1)",Dr. Seuss,https://www.goodreads.com/book/show/233093.The_Cat_in_the_Hat,,,,,
Where the Sidewalk Ends,Shel Silverstein,https://www.goodreads.com/book/show/30119.Where_the_Sidewalk_Ends,Where the Sidewalk Ends,Shel Silverstein,https://covers.openlibrary.org/b/id/31070-L.jpg,https://openlibrary.org/works/OL3368289W,"If you are a dreamer, come in, If you are a dreamer, A wisher, a liar, A hope-er, a pray-er, A magic bean buyer... Come in ... for where the sidewalk ends, Shel Silverstein's world begins. You'll meet a boy who turns into a TV set, and a girl who eats a whale. The Unicorn and the Bloath live there, and so does Sarah Cynthia Sylvia Stout who will not take the garbage out. It is a place where you wash your shadow and plant diamond gardens, a place where shoes fly, sisters are auctioned off, and crocodiles go to the dentist. Shel Silverstein's masterful collection of poems and drawings is at once outrageously funny and profound. This special edition has 12 extra poems the did not appear in the original collection. - Jacket flap."
If You Give a Mouse a Cookie,Laura Joffe Numeroff,https://www.goodreads.com/book/show/767680.If_You_Give_a_Mouse_a_Cookie,If You Give a Mouse a Cookie,Laura Joffe Numeroff,https://covers.openlibrary.org/b/id/50977-L.jpg,https://openlibrary.org/works/OL61432W,Relating the cycle of requests a mouse is likely to make after you give him a cookie takes the reader through a young child's day.
Love You Forever,Robert Munsch,https://www.goodreads.com/book/show/310259.Love_You_Forever,Love You Forever,Robert N Munsch,https://covers.openlibrary.org/b/id/772161-L.jpg,https://openlibrary.org/works/OL88707W,"The story details the cycle of life by chronicling the experiences of a young son and his mother throughout the course of the boy's life, and describing the exasperating behaviour exhibited by him throughout his youth. In spite of her occasional aggravation caused by her son's behaviour, the mother nonetheless visits his bedroom nightly to cradle him in her arms, and sing a brief lullaby promising to always love him. After her son enters adulthood and leaves home, his elderly mother occasionally sneaks into his bedroom at night to croon her customary lullaby. However she gradually grows old and frail, and her grown son visits his feeble, sickly mother for the final time. When he first arrives, his mother tries to sing her lullaby to him, but she is too weak to finish. He then cradles her in his arms and sings an altered rendition of her lullaby in reciprocation of the unconditional love that she had shown him throughout his life, vowing to always love her in return. After returning home in a scene implying the death of his mother, he cradles his newborn daughter and sings his mother's signature lullaby for her, implying that the cycle will continue."
Corduroy,Don Freeman,https://www.goodreads.com/book/show/231850.Corduroy,Corduroy,Don Freeman,https://covers.openlibrary.org/b/id/1333207-L.jpg,https://openlibrary.org/works/OL4114525W,"A toy bear in a department store wants a number of things, but when a little girl finally buys him he finds what he has always wanted most of all."
The Lorax,Dr. Seuss,https://www.goodreads.com/book/show/7784.The_Lorax,The Lorax,Dr. Seuss,https://covers.openlibrary.org/b/id/422253-L.jpg,https://openlibrary.org/works/OL261155W,"Long before ""going green"" was mainstream, Dr. Seuss's Lorax spoke for the trees and warned of the dangers of disrespecting the environment. In this cautionary rhyming tale (printed on recycled paper) we learn of the Once-ler, who came across a valley of Truffula Trees and Brown Bar-ba-loots, and how his harvesting of the tufted trees changed the landscape forever. - Publisher. The Lorax is the story of a boy who's looking for answers. Living in a ruined town, this little guy wants to know the story of the Lorax, so he goes to the Once-ler, an elderly inventor/manufacturer. Doc Brown -- ahem, the Once-ler -- tells the boy how the town came to be ruined, and most importantly, what he can do to turn things around. Who exactly was this this Lorax character, what was it doing here, and why was it taken away? These are questions only a man name the Once-ler can answer. The Once-ler's last words to the boy: ""Grow a forest. Protect it from axes that hack./ Then the Lorax/ and all of his friends/ may come back."" - shmoop.com"
Madeline,Ludwig Bemelmans,https://www.goodreads.com/book/show/475339.Madeline,Madeline's Rescue,Ludwig Bemelmans,https://covers.openlibrary.org/b/id/973931-L.jpg,https://openlibrary.org/works/OL1981005W,"A hound rescues a schoolgirl from the Seine, becomes a beloved school pet, is chased away by the trustees, and returns with a surprise."
"Harry Potter and the Sorcerer's Stone (Harry Potter, #1)",J.K. Rowling,https://www.goodreads.com/book/show/3.Harry_Potter_and_the_Sorcerer_s_Stone,,,,,
The Velveteen Rabbit,Margery Williams Bianco,https://www.goodreads.com/book/show/144974.The_Velveteen_Rabbit,The Velveteen Rabbit,Margery Williams Bianco,https://covers.openlibrary.org/b/id/8783171-L.jpg,https://openlibrary.org/works/OL812053W,"The Rabbit in the stocking isn't as expensive as the other toys: he's covered in velveteen. On Christmas Day, the Boy enjoys his new toy but then quickly forgets and neglects him. Shunned and unsure, the Velveteen Rabbit questions his worth. Should he even be called a real toy? An answer comes from his friend, the Skin Horse: ""Real isn't how you are made. . . .It's a thing that happens to you. When a child loves you for a long, long time, not just to play with, but REALLY loves you, then you become Real."" The Velveteen Rabbit's journey through love and loneliness to become who he was really meant to be is a story that inspires us all on our own journey to Real.

The Velveteen Rabbit is a timeless tale of friendship, love, acceptance and honesty. When the world seems uncertain, Margery Williams's classic story reminds all of us what really matters.

The type in this edition has been reset to emphasize the poetry of the language and to bring out the depth of sentiment in the story. William Nicholson's 1922 illustrations, which have delighted generations of readers, are rendered in full-color just as they appeared in the original edition of The Velveteen Rabbit. Together words and pictures create a world so much like our own, and yet so delightfully magical."
How the Grinch Stole Christmas!,Dr. Seuss,https://www.goodreads.com/book/show/113946.How_the_Grinch_Stole_Christmas_,How the Grinch Stole Christmas!,Dr. Seuss,https://covers.openlibrary.org/b/id/12055-L.jpg,https://openlibrary.org/works/OL261169W,"The Grinch tries to stop Christmas from arriving by stealing all the presents and food from the village, but much to his surprise it comes anyway. Could Christmas be more than presents?"
The Monster at the End of this Book,Jon Stone,https://www.goodreads.com/book/show/44186.The_Monster_at_the_End_of_this_Book,The Monster at the End of This Book,Jon Stone,https://covers.openlibrary.org/b/id/8580217-L.jpg,https://openlibrary.org/works/OL3009031W,"Is there a monster at the end of this book? Lovable, furry old Grover believes that there is, and he will try anything to stop you from turning the pages to find him! The Monster at the End of This Book, the bestselling Sesame Street book of all time, is an exciting and highly original tale that children will want to read again and again."
Curious George,H.A. Rey,https://www.goodreads.com/book/show/420297.Curious_George,Curious George at the Aquarium,H.A. and Margret Rey,https://covers.openlibrary.org/b/id/1325485-L.jpg,https://openlibrary.org/works/OL8217475W,
Chicka Chicka Boom Boom,Bill Martin Jr.,https://www.goodreads.com/book/show/293595.Chicka_Chicka_Boom_Boom,Chicka chicka boom boom,Bill Martin Jr.,https://covers.openlibrary.org/b/id/1320266-L.jpg,https://openlibrary.org/works/OL59121W,An alphabet rhyme/chant that relates what happens when the whole alphabet tries to climb a coconut tree.
The Little Prince,Antoine de Saint-Exupéry,https://www.goodreads.com/book/show/157993.The_Little_Prince,A day with the little prince,Antoine de Saint-Exupéry,https://covers.openlibrary.org/b/id/10746692-L.jpg,https://openlibrary.org/works/OL24259583W,"""The Little Prince tends his small planet--then enjoys the warm glow of sunset."""
"One Fish, Two Fish, Red Fish, Blue Fish",Dr. Seuss,https://www.goodreads.com/book/show/7770.One_Fish_Two_Fish_Red_Fish_Blue_Fish,"One Fish, Two Fish, Red Fish, Blue Fish",Dr. Seuss,https://covers.openlibrary.org/b/id/12096-L.jpg,https://openlibrary.org/works/OL261202W,"A story-poem about the activities of such unusual animals as the Nook, Wump, Yink, Yop, Gack, and the Zeds."
"Brown Bear, Brown Bear, What Do You See?",Bill Martin Jr.,https://www.goodreads.com/book/show/759611.Brown_Bear_Brown_Bear_What_Do_You_See_,"Brown Bear, Brown Bear, What Do You See?",Bill Martin Jr.,https://covers.openlibrary.org/b/id/12624136-L.jpg,https://openlibrary.org/works/OL59133W,"Children see a variety of animals, each one a different color, and a teacher looking at them."
"Alexander and the Terrible, Horrible, No Good, Very Bad Day",Judith Viorst,https://www.goodreads.com/book/show/46677.Alexander_and_the_Terrible_Horrible_No_Good_Very_Bad_Day,"Alexander and the Terrible, Horrible, No Good, Very Bad Day",Judith Viorst,https://covers.openlibrary.org/b/id/433572-L.jpg,https://openlibrary.org/works/OL1932036W,"On a day when everything goes wrong for him, Alexander is consoled by the thought that other people have bad days too."
Matilda,Roald Dahl,https://www.goodreads.com/book/show/39988.Matilda,Matilda,Roald Dahl,https://covers.openlibrary.org/b/id/12889769-L.jpg,https://openlibrary.org/works/OL45846W,"No podemos resistirnos a Matilda y recomendar a su autor a los niños que no lo conozcan. Matilda debe poner orden en una escuela poco acogedora porque sus profesores no están a la altura de su profesión. Pero el humor, la ironía y también la ternura harán que la escuela termine siendo un lugar amable donde ayuden a los niños a crecer y a leer. Roald Dahl decía que todos los niños tenían una brasa y que alguien debe encender el fuego y mantenerlo encendido. La escuela tiene este papel que cumplir porque de ello depende la luz del mundo.

Source: [1], back cover


  [1]: https://archive.org/details/matilda00roal"
"Harold and the Purple Crayon (Harold, #1)",Crockett Johnson,https://www.goodreads.com/book/show/98573.Harold_and_the_Purple_Crayon,,,,,
"The Tale of Peter Rabbit (World of Beatrix Potter, #1)",Beatrix Potter,https://www.goodreads.com/book/show/19321.The_Tale_of_Peter_Rabbit,,,,,
Are You My Mother?,P.D. Eastman,https://www.goodreads.com/book/show/197084.Are_You_My_Mother_,Are You My Mother?,P. D. Eastman,https://covers.openlibrary.org/b/id/538265-L.jpg,https://openlibrary.org/works/OL517221W,"The must-have, heartwarming and hilarious classic about a baby bird in search of his mother!

A baby bird goes in search of his mother in this hilarious Beginner Book edited by Dr. Seuss. When a mother bird's egg starts to jump, she hurries off to make sure she has something for her little one to eat. But as soon as she's gone, out pops the baby bird. He immediately sets off to find his mother, but not knowing what she looks like makes it a challenge. The little hatchling is determined to find his mother, even after meeting a kitten, a hen, a dog, and a Snort. The timeless message of the bond between mother and child make P. D. Eastman's Are You My Mother? a treasured classic. 

Originally created by Dr. Seuss, Beginner Books encourage children to read all by themselves, with simple words and illustrations that give clues to their meaning."
"Frog and Toad Are Friends (Frog and Toad, #1)",Arnold Lobel,https://www.goodreads.com/book/show/537296.Frog_and_Toad_Are_Friends,,,,,
"Oh, the Places You’ll Go!",Dr. Seuss,https://www.goodreads.com/book/show/191139.Oh_the_Places_You_ll_Go_,"Oh, the Places You'll Go!",Dr. Seuss,https://covers.openlibrary.org/b/id/5020952-L.jpg,https://openlibrary.org/works/OL261196W,"In this joyous ode to life, Dr. Seuss addresses graduates of all ages, from nursery school to medical school, and gives them the get-up-and-go to move mountains with the unrivaled exuberance and charm that have made Dr. Seuss's books favorites for years."
"Cloudy with a Chance of Meatballs (Cloudy with a Chance of Meatballs, #1)",Judi Barrett,https://www.goodreads.com/book/show/8073.Cloudy_with_a_Chance_of_Meatballs,,,,,
"The World of Winnie-the-Pooh (Winnie-the-Pooh, #1-2)",A.A. Milne,https://www.goodreads.com/book/show/99111.The_World_of_Winnie_the_Pooh,,,,,
The Secret Garden,Frances Hodgson Burnett,https://www.goodreads.com/book/show/2998.The_Secret_Garden,The Secret Garden,Frances Hodgson Burnett,https://covers.openlibrary.org/b/id/12622062-L.jpg,https://openlibrary.org/works/OL69612W,A ten-year-old orphan comes to live in a lonely house on the Yorkshire moors where she discovers an invalid cousin and the mysteries of a locked garden.
Alice’s Adventures in Wonderland / Through the Looking-Glass,Lewis Carroll,https://www.goodreads.com/book/show/24213.Alice_s_Adventures_in_Wonderland_Through_the_Looking_Glass,Alice's Adventures in Wonderland / Through the Looking Glass,Lewis Carroll,https://covers.openlibrary.org/b/id/8595966-L.jpg,https://openlibrary.org/works/OL151411W,"A very real little girl named Alice follows a remarkable rabbit down a rabbit hole and steps through a looking-glass to come face to face with some of the strangest adventures and some of the oddest characters in all literature. The crusty Duchess, the Mad Hatter, the weeping Mock Turtle, the diabolical Queen of Hearts, the Cheshire-Cat, Tweedledum and Tweedledee--each one is more eccentric, and more entertaining, than the last. And all of them could only have come from the pen of Lewis Carroll, one of the few adults ever to enter successfully the children's world of make-believe--a wonderland where the impossible becomes possible, the unreal, real...where the heights of adventure are limited only by the depths of imagination.
--back cover

Contains:

 - [Alice's Adventures in Wonderland](https://openlibrary.org/works/OL8193508W)
 - [Through the Looking Glass, and What Alice Found There][2]

  [2]: https://openlibrary.org/works/OL15298516W"
Guess How Much I Love You,Sam McBratney,https://www.goodreads.com/book/show/301736.Guess_How_Much_I_Love_You,Guess How Much I Love You,Sam McBratney,https://covers.openlibrary.org/b/id/13282906-L.jpg,https://openlibrary.org/works/OL58402W,"Welcome the family classic with an elegant, refreshed cover — the quintessential picture book, just waiting to be shared.

Sometimes, when you love someone very, very much, you want to find a way of describing how much you treasure them. But, as Little Nutbrown Hare and Big Nutbrown Hare discover, love is not an easy thing to measure! For two decades, Sam McBratney’s timelessly endearing story, beautifully rendered in Anita Jeram’s exquisite watercolors, has captured the deep and tender bond between parent and child. Guess How Much I Love You is one of the world’s best-loved picture books."
Horton Hears a Who!,Dr. Seuss,https://www.goodreads.com/book/show/7779.Horton_Hears_a_Who_,Horton Hears a Who!,Dr. Seuss,https://covers.openlibrary.org/b/id/422050-L.jpg,https://openlibrary.org/works/OL261228W,A city of Whos on a speck of dust are threatened with destruction until the smallest Who of all helps convince Horton's friends that Whos really exist.
"The Chronicles of Narnia (The Chronicles of Narnia, #1-7)",C.S. Lewis,https://www.goodreads.com/book/show/11127.The_Chronicles_of_Narnia,,,,,
"Pippi Longstocking (Pippi Långstrump, #1)",Astrid Lindgren,https://www.goodreads.com/book/show/19302.Pippi_Longstocking,,,,,
"Anne of Green Gables (Anne of Green Gables, #1)",L.M. Montgomery,https://www.goodreads.com/book/show/8127.Anne_of_Green_Gables,,,,,
The True Story of the 3 Little Pigs,Jon Scieszka,https://www.goodreads.com/book/show/125507.The_True_Story_of_the_3_Little_Pigs,True Story of the 3 Little Pigs,Jon Scieszka,,https://openlibrary.org/works/OL28834899W,
The Little Engine That Could,Watty Piper,https://www.goodreads.com/book/show/824204.The_Little_Engine_That_Could,The Little Engine That Could,Watty Piper,https://covers.openlibrary.org/b/id/446449-L.jpg,https://openlibrary.org/works/OL8137886W,
"Charlie and the Chocolate Factory (Charlie Bucket, #1)",Roald Dahl,https://www.goodreads.com/book/show/6310.Charlie_and_the_Chocolate_Factory,,,,,
"Amelia Bedelia  (Amelia Bedelia, #1)",Peggy Parish,https://www.goodreads.com/book/show/774001.Amelia_Bedelia,,,,,
"The Hobbit, or There and Back Again",J.R.R. Tolkien,https://www.goodreads.com/book/show/5907.The_Hobbit_or_There_and_Back_Again,,,,,
The BFG,Roald Dahl,https://www.goodreads.com/book/show/6319.The_BFG,The BFG,Roald Dahl,https://covers.openlibrary.org/b/id/9176033-L.jpg,https://openlibrary.org/works/OL45885W,"This book is a great book for all ages. It is a fantasy/adventure book.The BFG stands for 'Big Friendly Giant'. He isn't like other giants, instead of going out to different countries to eat children he catches dreams. When he find's a little orphan girl watching him, he kidnaps her because he doesn't want anyone to find out that he was there, but when they arrive at giant's land they become friends and set off into the world to save all the children from the hungry giants."
The Stinky Cheese Man and Other Fairly Stupid Tales,Jon Scieszka,https://www.goodreads.com/book/show/407429.The_Stinky_Cheese_Man_and_Other_Fairly_Stupid_Tales,The Stinky Cheese Man and Other Fairly Stupid Tales,Jon Scieszka,https://covers.openlibrary.org/b/id/2547013-L.jpg,https://openlibrary.org/works/OL39518W,"The Stinky Cheese Man and Other Fairly Stupid Tales is the ultimate in fractured fairy tales. Not only do the characters create their own stories, they also design the structure of the book itself. Classic fairy tales are deconstructed and rewritten with different but recognizable names, such as The Princess and the Bowling Ball, The Really Ugly Duckling, The Tortoise and the Hair and Chicken Licken. These stories and their characters intersect and create a mish-mash of narratives. Scieszka also mocks the conventions of books in general; the title page, dedication, and even the public information page have all been deconstructed. For example, Scieszka sneaks in the line “Anyone caught telling these fairly stupid tales will be visited, in person, by the Stinky Cheese Man” on the publication data page."
Stellaluna,Janell Cannon,https://www.goodreads.com/book/show/786256.Stellaluna,Stellaluna,Janell Cannon,https://covers.openlibrary.org/b/id/11026591-L.jpg,https://openlibrary.org/works/OL86707W,"Stellaluna is a 1993 children's book by Janell Cannon about a young fruit bat, Stellaluna, who becomes separated from her mother and finds her way to a nest of birds. She is adopted by them and learns bird-like behavior. Eventually, Stellaluna finds other bats and reunites with her mother, and she learns how to behave like a bat. She introduces the birds to her bat family. Stellaluna and the birds decide that, despite their many differences, they are still friends.

Stellaluna was a New York Times bestseller, appeared on the National Education Association's list of ""Teachers' Top 100 Books for Children"", and won several awards, including the 1996 Grammy Award for Best Spoken Word Album for Children."
The Poky Little Puppy,Janette Sebring Lowrey,https://www.goodreads.com/book/show/505304.The_Poky_Little_Puppy,The Poky Little Puppy,Janette Sebring Lowrey,https://covers.openlibrary.org/b/id/6458184-L.jpg,https://openlibrary.org/works/OL2810612W,A puppy who is always late coming home one night finds there is no dessert for him.
Make Way for Ducklings,Robert McCloskey,https://www.goodreads.com/book/show/29291.Make_Way_for_Ducklings,Make Way for Ducklings,Robert McCloskey,https://covers.openlibrary.org/b/id/400659-L.jpg,https://openlibrary.org/works/OL4638367W,"First published in 1941, the book tells the story of a pair of mallard ducks who decide to raise their family on an island in the lagoon in Boston Public Garden, a park in the center of Boston, Massachusetts. <sup>[1][1]</sup>


  [1]: http://en.wikipedia.org/wiki/Make_Way_for_Ducklings"
